{
  "identity": {
    "provider_code": "example",
    "dataset_code": "Population/01",
    "language": "en"
  },
  "id": [
    "year"
  ],
  "dimension": {
    "year": {
      "label": "Year",
      "category": {
        "index": {
          "2024": 0
        },
        "label": {
          "2024": "2024"
        }
      },
      "extension": {
        "elimination": false,
        "eliminationValueCode": "example",
        "noteMandatory": {
          "0": false
        },
        "categoryNoteMandatory": {
          "0": {
            "0": false
          }
        },
        "refperiod": {
          "0": "example"
        },
        "show": "example",
        "codelists": [
          {
            "id": "example",
            "label": "example",
            "type": "Aggregation",
            "links": [
              {
                "rel": "example",
                "hreflang": "example",
                "href": "https://example.org/resource"
              }
            ]
          }
        ],
        "measuringType": {
          "0": "Stock"
        },
        "priceType": {
          "0": "NotApplicable"
        },
        "adjustment": {
          "0": "None"
        },
        "basePeriod": {
          "0": "example"
        },
        "alternativeText": {
          "0": "example"
        }
      }
    }
  },
  "extension": {}
}
