{
  "identity": {
    "provider_code": "example",
    "dataset_code": "Population/01",
    "language": "en"
  },
  "id": [
    "year"
  ],
  "dimension": {
    "year": {
      "label": "Year",
      "category": {
        "index": {
          "2024": 0
        },
        "label": {
          "2024": "2024"
        }
      }
    }
  },
  "extension": {
    "future": {
      "scalar": false,
      "nested": {
        "null": null
      },
      "list": [
        1,
        2
      ]
    }
  }
}
