{
  "identity": {
    "provider_code": "csn",
    "dataset_code": "ABAKD12.px",
    "language": "sv"
  },
  "id": [
    "Folkbokföring län",
    "Skuldberäkningsdatum",
    "Kön",
    "Antal personer, Ingående skuld"
  ],
  "dimension": {
    "Folkbokföring län": {
      "label": "Folkbokföring län",
      "category": {
        "index": {
          "0": 0,
          "1": 1,
          "2": 2,
          "3": 3,
          "4": 4,
          "5": 5,
          "6": 6,
          "7": 7,
          "8": 8,
          "9": 9,
          "10": 10,
          "11": 11,
          "12": 12,
          "13": 13,
          "14": 14,
          "15": 15,
          "16": 16,
          "17": 17,
          "18": 18,
          "19": 19,
          "20": 20,
          "21": 21,
          "22": 22,
          "23": 23
        },
        "label": {
          "0": "Totalt",
          "1": "-1 Ej folkbokförd i Sverige",
          "2": "00 Sverige",
          "3": "01  Stockholms län",
          "4": "03  Uppsala län",
          "5": "04  Södermanlands län",
          "6": "05  Östergötlands län",
          "7": "06  Jönköpings län",
          "8": "07  Kronobergs län",
          "9": "08  Kalmar län",
          "10": "09  Gotlands län",
          "11": "10  Blekinge län",
          "12": "12  Skåne län",
          "13": "13  Hallands län",
          "14": "14  Västra Götalands län",
          "15": "17  Värmlands län",
          "16": "18  Örebro län",
          "17": "19  Västmanlands län",
          "18": "20  Dalarnas län",
          "19": "21  Gävleborgs län",
          "20": "22  Västernorrlands län",
          "21": "23  Jämtlands län",
          "22": "24  Västerbottens län",
          "23": "25  Norrbottens län"
        },
        "note": {
          "0": [
            "Om 'Totalt' väljs redovisas nettototalen för alla, vilket innebär att varje person bara räknas en gång. Totaluppgifter i tabellerna svarar mot summan av samtliga värden som är möjliga att välja för en delpopulation eller en redovisningsgrupp. Totalen innebär alltså inte en summering av valda värden."
          ],
          "1": [
            "Observera att ’Ej folkbokförd i Sverige’ inte nödvändigtvis är samma sak som ’Bedömd bosättning utomlands’."
          ]
        }
      },
      "note": [
        "Det län som personen är folkbokförd i enligt folkbokföringen vid föregående års slut."
      ],
      "extension": {
        "elimination": true,
        "eliminationValueCode": "0",
        "show": "value",
        "position": 0
      }
    },
    "Skuldberäkningsdatum": {
      "label": "Skuldberäkningsdatum",
      "category": {
        "index": {
          "0": 0,
          "1": 1,
          "2": 2,
          "3": 3,
          "4": 4,
          "5": 5,
          "6": 6,
          "7": 7,
          "8": 8,
          "9": 9,
          "10": 10,
          "11": 11,
          "12": 12,
          "13": 13,
          "14": 14,
          "15": 15,
          "16": 16,
          "17": 17
        },
        "label": {
          "0": "2009-01-01",
          "1": "2010-01-01",
          "2": "2011-01-01",
          "3": "2012-01-01",
          "4": "2013-01-01",
          "5": "2014-01-01",
          "6": "2015-01-01",
          "7": "2016-01-01",
          "8": "2017-01-01",
          "9": "2018-01-01",
          "10": "2019-01-01",
          "11": "2020-01-01",
          "12": "2021-01-01",
          "13": "2022-01-01",
          "14": "2023-01-01",
          "15": "2024-01-01",
          "16": "2025-01-01",
          "17": "2026-01-01"
        },
        "note": {
          "0": [
            "Enstaka personer som saknar uppgift om könstillhörighet ingår inte i statistiken."
          ]
        }
      },
      "note": [
        "Det skuldberäkningsdatum som avses."
      ],
      "extension": {
        "elimination": false,
        "show": "value",
        "position": 1
      }
    },
    "Kön": {
      "label": "Kön",
      "category": {
        "index": {
          "0": 0,
          "1": 1,
          "2": 2
        },
        "label": {
          "0": "Kvinnor",
          "1": "Män",
          "2": "Totalt"
        }
      },
      "note": [
        "Med kön avses det juridiska könet. Personer som har bytt juridiskt kön under tidsperioden kan förekomma i båda könskategorierna."
      ],
      "extension": {
        "elimination": true,
        "show": "value",
        "position": 2
      }
    },
    "Antal personer, Ingående skuld": {
      "label": "Antal personer, Ingående skuld",
      "category": {
        "index": {
          "0": 0,
          "1": 1
        },
        "label": {
          "0": "Antal personer",
          "1": "Belopp (MSEK)"
        },
        "note": {
          "0": [
            "Antal personer. Vid en fördelning på flera olika variabler kan personen vanligen förekomma på fler än ett ställe. Alla totaler är nettoräknade, vilket innebär att varje person bara räknas en gång. Tabellen har sekretessgranskats, vilket innebär att enskilda celler med antal färre än 3 har ersatts med dubbelprick '..'."
          ],
          "1": [
            "Ingående skuld i miljoner kronor. I databasen är det möjligt att välja 1-6 decimaler. Notera att det val av decimaler som görs följer med vid export till andra program, vilket innebär att underliggande decimaler inte redovisas. På grund av avrundningar kan det uppstå differenser mellan totalsumman och delsummorna vid en sammanräkning."
          ]
        }
      },
      "extension": {
        "elimination": false,
        "show": "value",
        "position": 3
      }
    }
  },
  "official_statistics": true,
  "source": "Centrala studiestödsnämnden, CSN.",
  "note": [
    "Fotnoter med tabellförklaringar visas längst ned under rubriken 'Fotnoter'.",
    "Tabellen visar antalet personer med återkrav och återkravsbeloppet vid respektive skuldberäkningstillfälle. Återkrav är ett beslut om att återbetala ett belopp man inte haft rätt till och därför blivit direkt återbetalningsskyldig för. Personer vars hela skuld omfattas av skuldsanering ingår inte i statistiken. För mer information om regelverket, se csn.se."
  ],
  "metadata_url": "https://statistik.csn.se/PXWeb/api/v1/sv/CSNstat/AB/AK/ABAKD12.px",
  "extension": {
    "px": {
      "decimals": 0,
      "official-statistics": true,
      "aggregallowed": true,
      "language": "sv",
      "matrix": "ABAKD12",
      "subject-code": "Återbetalning"
    }
  },
  "paths": [
    {
      "path": [
        {
          "code": "AB",
          "label": "Studieskulder och inbetalning av studiestöd"
        },
        {
          "code": "AK",
          "label": "Återkrav av studiestöd"
        }
      ]
    }
  ],
  "subject": {
    "code": "Återbetalning",
    "label": "Återkrav av studiestöd"
  },
  "retrieval": {
    "type": "pxweb_v1",
    "config": {
      "data_url": "https://statistik.csn.se/PXWeb/api/v1/sv/CSNstat/AB/AK/ABAKD12.px"
    }
  }
}
